Type|Title|Start Date|End Date|Location|Description
Workshops|Workshop de Desenvolvimento Web com JavaScript para Iniciantes #CPNatal2 #COMUNIDADEDEVOPSRN|18 de Junho de 2019 às 13:15|18 de Agosto de 2019 às 14:00|Natal, Rio Grande do Norte, Brazil|
Workshops|Break the problem #CPNatal2 #COMUNIDADELEP|16 de Agosto de 2019 às 22:00|16 de Agosto de 2019 às 22:45|Natal, Rio Grande do Norte, Brazil|
Workshops|O que é o heroku e como utilizá-lo #CPNatal2 #COMUNIDADEDEVOPSRN|16 de Agosto de 2019 às 23:00|16 de Agosto de 2019 às 23:45|Natal, Rio Grande do Norte, Brazil|
Workshops|Modelando com Thinkercad #CPNatal2 #OpenCampus|17 de Agosto de 2019 às 10:30|17 de Agosto de 2019 às 12:30|Natal, Rio Grande do Norte, Brazil|
Workshops|Robótica Sustentável: Carrinho a propulsão a ar #CPNatal2 #OpenCampus|17 de Agosto de 2019 às 10:30|17 de Agosto de 2019 às 12:30|Natal, Rio Grande do Norte, Brazil|
Workshops|Introdução ao HTML e CSS: Colorindo o mundo web #CPNatal2 #COMUNIDADEASBOYZINHASARRETADAS|17 de Agosto de 2019 às 11:00|17 de Agosto de 2019 às 13:00|Natal, Rio Grande do Norte, Brazil|
Workshops|Afinal, o que é uma metodologia ágil? #CPNatal2 #COMUNIDADELEP|17 de Agosto de 2019 às 12:00|17 de Agosto de 2019 às 13:00|Natal, Rio Grande do Norte, Brazil|
Workshops|Primeiros passos para um DIY home Jarvis #CPNatal2 #COMUNIDADEDUMONTHACKERSPACE|17 de Agosto de 2019 às 12:00|17 de Agosto de 2019 às 13:00|Natal, Rio Grande do Norte, Brazil|
Workshops|Pensamento Computacional Desplugado #CPNatal2 ##OpenCampus|17 de Agosto de 2019 às 12:30|17 de Agosto de 2019 às 13:30|Natal, Rio Grande do Norte, Brazil|
Workshops|Luminária Vingadores #CPNatal2 #OpenCampus|17 de Agosto de 2019 às 12:30|17 de Agosto de 2019 às 13:30|Natal, Rio Grande do Norte, Brazil|
Workshops|Minicurso de Pitch - Como prender a atenção e gerar interesse da forma certa #CPNatal2 #COMUNIDADELEP|17 de Agosto de 2019 às 13:15|17 de Agosto de 2019 às 14:00|Natal, Rio Grande do Norte, Brazil|
Workshops|Design Gráfico com software livre, Inkscape no Marketing Digital #CPNatal2 #COMUNIDADEDUMONTHACKERSPACE|17 de Agosto de 2019 às 13:15|17 de Agosto de 2019 às 14:00|Natal, Rio Grande do Norte, Brazil|
Workshops|Arduíno na Educação do Futuro #CPNatal2 #OpenCampus|17 de Agosto de 2019 às 14:00|17 de Agosto de 2019 às 15:30|Natal, Rio Grande do Norte, Brazil|
Workshops|Programando com o Scratch #CPNatal2 #OpenCampus|17 de Agosto de 2019 às 14:00|17 de Agosto de 2019 às 15:30|Natal, Rio Grande do Norte, Brazil|
Workshops|Oficina de Ferramentas #CPNatal2 #COMUNIDADEASBOYZINHASARRETADAS|17 de Agosto de 2019 às 15:15|17 de Agosto de 2019 às 16:00|Natal, Rio Grande do Norte, Brazil|
Workshops|Automação Residencial Básica #CPNatal2 #OpenCampus|17 de Agosto de 2019 às 15:30|17 de Agosto de 2019 às 17:00|Natal, Rio Grande do Norte, Brazil|
Workshops|Minicompetição de Planadores no ambiente escolar #CPNatal2 #OpenCampus|17 de Agosto de 2019 às 15:30|17 de Agosto de 2019 às 17:00|Natal, Rio Grande do Norte, Brazil|
Workshops|Deploy de aplicações com Docker e Jenkins #CPNatal2 #COMUNIDADEDEVOPSRN|17 de Agosto de 2019 às 16:15|17 de Agosto de 2019 às 17:30|Natal, Rio Grande do Norte, Brazil|
Workshops|Quebrando captchas vulneráveis com processamento de imagens #CPNatal2 #COMUNIDADEDUMONTHACKERSPACE|17 de Agosto de 2019 às 16:15|17 de Agosto de 2019 às 17:00|Natal, Rio Grande do Norte, Brazil|
Workshops|Quebrando captchas vulneráveis com processamento de imagens #CPNatal2 #COMUNIDADEDUMONTHACKERSPACE|17 de Agosto de 2019 às 17:15|17 de Agosto de 2019 às 18:00|Natal, Rio Grande do Norte, Brazil|
Workshops|Arte na Educação do Futuro #CPNatal2 #OpenCampus|17 de Agosto de 2019 às 17:30|17 de Agosto de 2019 às 19:00|Natal, Rio Grande do Norte, Brazil|
Workshops|Arduino Básico - Sensor de Proximidade com Leds #CPNatal2 #OpenCampus|17 de Agosto de 2019 às 17:30|17 de Agosto de 2019 às 19:00|Natal, Rio Grande do Norte, Brazil|
Workshops|Cloud Study Jams #CPNatal2 #COMUNIDADEDEVOPSRN|17 de Agosto de 2019 às 18:35|17 de Agosto de 2019 às 19:15|Natal, Rio Grande do Norte, Brazil|
Workshops|Minicurso de Gestão de Tempo e Produtividade #CPNatal2 #COMUNIDADELEP|17 de Agosto de 2019 às 19:15|17 de Agosto de 2019 às 20:00|Natal, Rio Grande do Norte, Brazil|
Workshops|Git básico e alguns serviços #CPNatal2 #COMUNIDADEDEVOPSRN|17 de Agosto de 2019 às 19:20|17 de Agosto de 2019 às 20:30|Natal, Rio Grande do Norte, Brazil|
Workshops|Usando Ansible para fazer deploy da sua primeira aplicação no Heroku #CPNatal2 #COMUNIDADEDEVOPSRN|17 de Agosto de 2019 às 23:00|18 de Agosto de 2019 às 00:15|Natal, Rio Grande do Norte, Brazil|
Workshops|Minicompetição de Planadores no ambiente escolar #CPNatal2 #OpenCampus|18 de Agosto de 2019 às 10:30|18 de Agosto de 2019 às 12:30|Natal, Rio Grande do Norte, Brazil|
Workshops|Modelando com Thinkercad #CPNatal2 #OpenCampus|18 de Agosto de 2019 às 10:30|18 de Agosto de 2019 às 12:30|Natal, Rio Grande do Norte, Brazil|
Workshops|Precisando de dados? Colete-os com Web Scraping #CPNatal2 #COMUNIDADEDUMONTHACKERSPACE|18 de Agosto de 2019 às 11:00|18 de Agosto de 2019 às 11:45|Natal, Rio Grande do Norte, Brazil|
Workshops|PyautoGUI: brincando com a GUI#CPNatal2 #COMUNIDADEDUMONTHACKERSPACE|18 de Agosto de 2019 às 12:00|18 de Agosto de 2019 às 13:00|Natal, Rio Grande do Norte, Brazil|
Workshops|Como aprender baseado em projetos? #CPNatal2 #OpenCampus|18 de Agosto de 2019 às 12:30|18 de Agosto de 2019 às 13:30|Natal, Rio Grande do Norte, Brazil|
Workshops|Luminária Vingadores #CPNatal2 #OpenCampus|18 de Agosto de 2019 às 12:30|18 de Agosto de 2019 às 13:30|Natal, Rio Grande do Norte, Brazil|
Workshops|Robótica Sustentável: Carrinho Sustentável Elétrico #CPNatal2 #OpenCampus|18 de Agosto de 2019 às 14:00|18 de Agosto de 2019 às 15:30|Natal, Rio Grande do Norte, Brazil|
Workshops|Avaliação Concurso Leve seu Robô #CPNatal2 #OpenCampus|18 de Agosto de 2019 às 14:00|18 de Agosto de 2019 às 15:30|Natal, Rio Grande do Norte, Brazil|
Workshops|TDD com Python #COMUNIDADEASBOYZINHASARRETADAS|18 de Agosto de 2019 às 14:05|18 de Agosto de 2019 às 15:00|Natal, Rio Grande do Norte, Brazil|
Workshops|Workshop de Desenvolvimento Web com JavaScript para Iniciantes CPNatal2 #COMUNIDADEDEVOPSRN|18 de Agosto de 2019 às 14:15|18 de Agosto de 2019 às 15:30|Natal, Rio Grande do Norte, Brazil|
Workshops|Robô com rodas usando Arduíno #CPNatal2 #COMUNIDADEDUMONTHACKERSPACE|18 de Agosto de 2019 às 15:15|18 de Agosto de 2019 às 16:00|Natal, Rio Grande do Norte, Brazil|
Workshops|Ferramentas para a Educação 4.0 #CPNatal2 #OpenCampus|18 de Agosto de 2019 às 15:30|18 de Agosto de 2019 às 17:00|Natal, Rio Grande do Norte, Brazil|
Workshops|Automação Residencial Básica #CPNatal2 #OpenCampus|18 de Agosto de 2019 às 15:30|18 de Agosto de 2019 às 17:00|Natal, Rio Grande do Norte, Brazil|
Workshops|Introdução desenhos e animações em Javascript #CPNatal2 #COMUNIDADEDUMONTHACKERSPACE|18 de Agosto de 2019 às 16:15|18 de Agosto de 2019 às 17:00|Natal, Rio Grande do Norte, Brazil|
Workshops|Eu nunca...: Desvendando o machismo de todo dia #CPNatal2 #COMUNIDADEASBOYZINHASARRETADAS|18 de Agosto de 2019 às 17:05|18 de Agosto de 2019 às 18:00|Natal, Rio Grande do Norte, Brazil|
Workshops|[intro a python] Programação Orientada a Problemas #COMUNIDADEDUMONTHACKERSPACE|18 de Agosto de 2019 às 17:15|18 de Agosto de 2019 às 18:00|Natal, Rio Grande do Norte, Brazil|
Workshops|Git para equipes e contribuição em projetos de software livre #CPNatal2 #COMUNIDADEDEVOPSRN|18 de Agosto de 2019 às 17:15|18 de Agosto de 2019 às 18:30|Natal, Rio Grande do Norte, Brazil|
Workshops|Arduino Básico - Sensor de Proximidade com Leds #CPNatal2 #OpenCampus|18 de Agosto de 2019 às 17:30|18 de Agosto de 2019 às 19:00|Natal, Rio Grande do Norte, Brazil|
Workshops|IoT na Educação do Futuro #CPNatal2 #OpenCampus|18 de Agosto de 2019 às 17:30|18 de Agosto de 2019 às 19:00|Natal, Rio Grande do Norte, Brazil|
Conferência|Cerimônia Abertura Campus Party Natal #CPNatal2|16 de Agosto de 2019 às 19:00|16 de Agosto de 2019 às 20:00|Natal, Rio Grande do Norte, Brazil|
Conferência|A mulher na indústria de jogos #CPNatal2 #COMUNIDADEASBOYZINHASARRETADAS|16 de Agosto de 2019 às 22:00|16 de Agosto de 2019 às 23:00|Natal, Rio Grande do Norte, Brazil|
Conferência|Segurança em Nuvem: a ameaça fantasma #CPNatal2 #COMUNIDADEDEVOPSRN|16 de Agosto de 2019 às 22:00|16 de Agosto de 2019 às 22:45|Natal, Rio Grande do Norte, Brazil|
Conferência|5 passos para Colocar seu Projeto (e sua Carreira) na Direção Certa #CPNatal2|16 de Agosto de 2019 às 22:00|16 de Agosto de 2019 às 22:45|Natal, Rio Grande do Norte, Brazil|
Conferência|Como conectar o cérebro com um Arduino #CPNatal2 #COMUNIDADEDUMONTHACKERSPACE|16 de Agosto de 2019 às 22:00|16 de Agosto de 2019 às 22:45|Natal, Rio Grande do Norte, Brazil|
Conferência|Expectativa vs Realidade de trabalhar com dados #CPNatal2 #COMUNIDADEASBOYZINHASARRETADAS|16 de Agosto de 2019 às 23:00|17 de Agosto de 2019 às 00:00|Natal, Rio Grande do Norte, Brazil|
Conferência|Design Thinking: Solucionando problemas de maneira criativa #CPNatal2 #COMUNIDADELEP|16 de Agosto de 2019 às 23:00|16 de Agosto de 2019 às 23:45|Natal, Rio Grande do Norte, Brazil|
Conferência|O Guia de sobrevivência na CPNatal2 #CPNatal2|16 de Agosto de 2019 às 23:00|16 de Agosto de 2019 às 23:45|Natal, Rio Grande do Norte, Brazil|
Conferência|Bug Bounty - Um pouco sobre #CPNatal2 #COMUNIDADEDUMONTHACKERSPACE|16 de Agosto de 2019 às 23:00|16 de Agosto de 2019 às 23:45|Natal, Rio Grande do Norte, Brazil|
Conferência|Utilização de sucata no ensino da Robótica Educacional #CPNatal2 #OpenCampus|17 de Agosto de 2019 às 10:30|17 de Agosto de 2019 às 11:30|Natal, Rio Grande do Norte, Brazil|
Conferência|Gerenciamento de backup com Bareos #CPNatal2 #COMUNIDADEDEVOPSRN|17 de Agosto de 2019 às 11:00|17 de Agosto de 2019 às 11:45|Natal, Rio Grande do Norte, Brazil|
Conferência|Dieta Digital - O que é e por que é uma tendência mundial? #CPNatal2 #COMUNIDADELEP|17 de Agosto de 2019 às 11:00|17 de Agosto de 2019 às 11:45|Natal, Rio Grande do Norte, Brazil|
Conferência|Trabalho remoto para Devs 101 #CPNatal2|17 de Agosto de 2019 às 11:00|17 de Agosto de 2019 às 11:45|Natal, Rio Grande do Norte, Brazil|
Conferência|Adafruit Circuit Playground Express: Uma alternativa ao Arduino e que suporta Python #CPNatal2 #COMUNIDADEDUMONTHACKERSPACE|17 de Agosto de 2019 às 11:00|17 de Agosto de 2019 às 11:45|Natal, Rio Grande do Norte, Brazil|
Conferência|Destravando a sua criatividade #CPNatal2|17 de Agosto de 2019 às 11:00|17 de Agosto de 2019 às 11:45|Natal, Rio Grande do Norte, Brazil|
Conferência|Transformação digital, o que não é! #CPNatal2|17 de Agosto de 2019 às 11:00|17 de Agosto de 2019 às 11:45|Natal, Rio Grande do Norte, Brazil|
Conferência|Transparência Pública e o Controle Social #CPNatal2|17 de Agosto de 2019 às 11:00|17 de Agosto de 2019 às 11:45|Natal, Rio Grande do Norte, Brazil|
Conferência|Wireless do sertão - técnicas de baixo custo e impressão 3D para fabricação de dispositivos de radiofrequência #CPNatal2 #OpenCampus|17 de Agosto de 2019 às 11:45|17 de Agosto de 2019 às 12:45|Natal, Rio Grande do Norte, Brazil|
Conferência|Comece sua startup global em Natal #CPNatal2|17 de Agosto de 2019 às 12:00|17 de Agosto de 2019 às 13:00|Natal, Rio Grande do Norte, Brazil|
Conferência|Falha Critica - Sua aplicação/código está realmente seguro? #CPNatal2 #COMUNIDADEDEVOPSRN|17 de Agosto de 2019 às 12:00|17 de Agosto de 2019 às 13:00|Natal, Rio Grande do Norte, Brazil|
Conferência|Comece sua startup global em Natal #CPNatal2|17 de Agosto de 2019 às 12:00|17 de Agosto de 2019 às 13:00|Natal, Rio Grande do Norte, Brazil|
Conferência|Marketing Digital e o Consumidor 2.0 #CPNatal2|17 de Agosto de 2019 às 12:00|17 de Agosto de 2019 às 13:00|Natal, Rio Grande do Norte, Brazil|
Conferência|Segurança da informação no desenvolvimento de novas aplicações #CPNatal2|17 de Agosto de 2019 às 12:00|17 de Agosto de 2019 às 13:00|Natal, Rio Grande do Norte, Brazil|
Conferência|Pedofilia: um desafio frente as novas tecnologias #CPNatal2 #OpenCampus|17 de Agosto de 2019 às 13:00|17 de Agosto de 2019 às 13:45|Natal, Rio Grande do Norte, Brazil|
Conferência|Cidade para mulheres feita por mulheres #CPNatal2 #COMUNIDADEASBOYZINHASARRETADAS|17 de Agosto de 2019 às 13:05|17 de Agosto de 2019 às 13:55|Natal, Rio Grande do Norte, Brazil|
Conferência|DevSecOps - Continuous Application Security Testing #CPNatal2 #COMUNIDADEDEVOPSRN|17 de Agosto de 2019 às 13:15|17 de Agosto de 2019 às 14:00|Natal, Rio Grande do Norte, Brazil|
Conferência|Nota Potiguar Cidadania fiscal inovação e tecnologia #CPNatal2|17 de Agosto de 2019 às 13:15|17 de Agosto de 2019 às 14:00|Natal, Rio Grande do Norte, Brazil|
Conferência|Parque da Cidade - Espaço de conhecimento, lazer e qualidade de vida #CPNatal2|17 de Agosto de 2019 às 13:15|17 de Agosto de 2019 às 14:00|Natal, Rio Grande do Norte, Brazil|
Conferência|Ser uma Artista Mulher #CPNatal2 #COMUNIDADEASBOYZINHASARRETADAS|17 de Agosto de 2019 às 14:00|17 de Agosto de 2019 às 15:00|Natal, Rio Grande do Norte, Brazil|
Conferência|Sustentabilidade da TI – Escola de TI para a gestão pública e RN CONSIGSustentabilidade da TI – Escola de TI para a gestão pública e RN CONSIG #CPNatal2 #OpenCampus|17 de Agosto de 2019 às 14:00|17 de Agosto de 2019 às 14:45|Natal, Rio Grande do Norte, Brazil|
Conferência|A relação da tecnologia e a saúde mental #CPNatal2|17 de Agosto de 2019 às 14:15|17 de Agosto de 2019 às 15:00|Natal, Rio Grande do Norte, Brazil|
Conferência|Programação para Noobs #CPNatal2 #COMUNIDADEDEVOPSRN|17 de Agosto de 2019 às 14:15|17 de Agosto de 2019 às 15:00|Natal, Rio Grande do Norte, Brazil|
Conferência|Como a Inteligência Artificial atua na Gestão de Projetos? #CPNatal2|17 de Agosto de 2019 às 14:15|17 de Agosto de 2019 às 15:00|Natal, Rio Grande do Norte, Brazil|
Conferência|Hacking Mifare Classic Cards #CPNatal2 #COMUNIDADEDUMONTHACKERSPACE|17 de Agosto de 2019 às 14:15|17 de Agosto de 2019 às 15:00|Natal, Rio Grande do Norte, Brazil|
Conferência|O Poder do Mágico: Como aumentar drasticamente as chances de alguém fazer o que você quer #CPNatal2 #COMUNIDADELEP|17 de Agosto de 2019 às 14:15|17 de Agosto de 2019 às 15:00|Natal, Rio Grande do Norte, Brazil|
Conferência|HACTUS CRIATIVE - RoboLed e Cosplay ao Maker #CPNatal2|17 de Agosto de 2019 às 14:15|17 de Agosto de 2019 às 15:00|Natal, Rio Grande do Norte, Brazil|
Conferência|Interface Cérebro-Máquina: Decodificando o Cérebro #CPNatal2|17 de Agosto de 2019 às 14:15|17 de Agosto de 2019 às 15:00|Natal, Rio Grande do Norte, Brazil|
Conferência|Educação e Tecnologia #CPNatal2 #OpenCampus|17 de Agosto de 2019 às 15:00|17 de Agosto de 2019 às 15:45|Natal, Rio Grande do Norte, Brazil|
Conferência|Iot na saúde #CPNatal2|17 de Agosto de 2019 às 15:15|17 de Agosto de 2019 às 16:00|Natal, Rio Grande do Norte, Brazil|
Conferência|RUMO AO VALE! - Uma experiência que é real #CPNatal2|17 de Agosto de 2019 às 15:15|17 de Agosto de 2019 às 16:00|Natal, Rio Grande do Norte, Brazil|
Conferência|Fruggy: Desenvolvendo soluções criativas e tecnológicas para os ODS #CPNatal2|17 de Agosto de 2019 às 15:15|17 de Agosto de 2019 às 16:00|Natal, Rio Grande do Norte, Brazil|
Conferência|Angular Extreme performance #CPNatal2 #COMUNIDADEDEVOPSRN|17 de Agosto de 2019 às 15:15|17 de Agosto de 2019 às 16:00|Natal, Rio Grande do Norte, Brazil|
Conferência|Gestão de Projetos #CPNatal2 #COMUNIDADELEP|17 de Agosto de 2019 às 15:15|17 de Agosto de 2019 às 16:00|Natal, Rio Grande do Norte, Brazil|
Conferência|Hackeando o Marketing das grandes empresas #CPNatal2|17 de Agosto de 2019 às 15:15|17 de Agosto de 2019 às 16:00|Natal, Rio Grande do Norte, Brazil|
Conferência|Aprendendo a negociar com Harvey Specter #CPNatal2 #COMUNIDADEDUMONTHACKERSPACE|17 de Agosto de 2019 às 15:15|17 de Agosto de 2019 às 16:00|Natal, Rio Grande do Norte, Brazil|
Conferência|A privacidade morreu?? #CPNatal2 #OpenCampus|17 de Agosto de 2019 às 16:00|17 de Agosto de 2019 às 16:45|Natal, Rio Grande do Norte, Brazil|
Conferência|O protagonismo das mulheres jovens #CPNatal2 #COMUNIDADEASBOYZINHASARRETADAS|17 de Agosto de 2019 às 16:05|17 de Agosto de 2019 às 17:00|Natal, Rio Grande do Norte, Brazil|
Conferência|Estratégias para Instagram #CPNatal2|17 de Agosto de 2019 às 16:15|17 de Agosto de 2019 às 17:00|Natal, Rio Grande do Norte, Brazil|
Conferência|Validando Ideias - As duas faces do empreendedorismo #CPNatal2|17 de Agosto de 2019 às 16:15|17 de Agosto de 2019 às 17:00|Natal, Rio Grande do Norte, Brazil|
Conferência|PyLadies Brasil: ajudando a tornar a comunidade Python mais diversa e mais inclusiva #CPNatal2|17 de Agosto de 2019 às 16:15|17 de Agosto de 2019 às 17:00|Natal, Rio Grande do Norte, Brazil|
Conferência|LGPD: como se adequar até 2020? #CPNatal2 #OpenCampus|17 de Agosto de 2019 às 17:00|17 de Agosto de 2019 às 17:45|Natal, Rio Grande do Norte, Brazil|
Conferência|Redes sociais, inteligência artificial e a produção do discurso #CPNatal2 #COMUNIDADEASBOYZINHASARRETADAS|17 de Agosto de 2019 às 17:05|17 de Agosto de 2019 às 17:55|Natal, Rio Grande do Norte, Brazil|
Conferência|IOT e a acessibilidade #CPNatal2|17 de Agosto de 2019 às 17:15|17 de Agosto de 2019 às 18:00|Natal, Rio Grande do Norte, Brazil|
Conferência|Compartilhamento e Networking para Crescer na sua carreira #CPNatal2|17 de Agosto de 2019 às 17:15|17 de Agosto de 2019 às 18:00|Natal, Rio Grande do Norte, Brazil|
Conferência|Criando negócios tecnológicos #CPNatal2|17 de Agosto de 2019 às 17:15|17 de Agosto de 2019 às 18:00|Natal, Rio Grande do Norte, Brazil|
Conferência|Gestão do que mais importa: Tempo e Dinheiro! #CPNatal2 #COMUNIDADELEP|17 de Agosto de 2019 às 17:15|17 de Agosto de 2019 às 18:00|Natal, Rio Grande do Norte, Brazil|
Conferência|O poder da criatividade na criação de negócios de impacto social e no atendimento ao cliente #CPNatal2|17 de Agosto de 2019 às 17:15|17 de Agosto de 2019 às 18:00|Natal, Rio Grande do Norte, Brazil|
Conferência|Flask from Rest to Test #CPNatal2 #COMUNIDADEDEVOPSRN|17 de Agosto de 2019 às 17:45|17 de Agosto de 2019 às 18:30|Natal, Rio Grande do Norte, Brazil|
Conferência|"O problema é na placa mãe..." : as dificuldades de ser mulher e mãe na TI #CPNatal2 #COMUNIDADEASBOYZINHASARRETADAS|17 de Agosto de 2019 às 18:00|17 de Agosto de 2019 às 19:00|Natal, Rio Grande do Norte, Brazil|
Conferência|Oficina de Chão - Robótica Disruptiva #CPNatal2 #OpenCampus|17 de Agosto de 2019 às 18:00|17 de Agosto de 2019 às 18:45|Natal, Rio Grande do Norte, Brazil|
Conferência|O Empreendedor da Era 4.0 #CPNatal2|17 de Agosto de 2019 às 18:15|17 de Agosto de 2019 às 19:00|Natal, Rio Grande do Norte, Brazil|
Conferência|Criando uma aplicação IoT com Arduino e Firebase usando apenas Javascript #CPNatal2|17 de Agosto de 2019 às 18:15|17 de Agosto de 2019 às 19:00|Natal, Rio Grande do Norte, Brazil|
Conferência|Mini Paredão Eletrônico e ciclo paredões #CPNatal2|17 de Agosto de 2019 às 18:15|17 de Agosto de 2019 às 19:00|Natal, Rio Grande do Norte, Brazil|
Conferência|Titulo Cidadão Natalense #CPNatal2|17 de Agosto de 2019 às 18:15|17 de Agosto de 2019 às 19:00|Natal, Rio Grande do Norte, Brazil|
Conferência|Web hacking para CTF e Bug Hunters #CPNatal2 #COMUNIDADEDUMONTHACKERSPACE|17 de Agosto de 2019 às 18:15|17 de Agosto de 2019 às 19:00|Natal, Rio Grande do Norte, Brazil|
Conferência|HUMANufacturing Tech: não há nada mais humano do que a tecnologia #CPNatal2 #OpenCampus|17 de Agosto de 2019 às 19:00|17 de Agosto de 2019 às 20:00|Natal, Rio Grande do Norte, Brazil|
Conferência|Design Sprint: do Google para sua realidade #CPNatal2 #COMUNIDADEASBOYZINHASARRETADAS|17 de Agosto de 2019 às 19:05|17 de Agosto de 2019 às 20:00|Natal, Rio Grande do Norte, Brazil|
Conferência|Como é a carreira em engenharia (desenvolvimento) de software? #CPNatal2|17 de Agosto de 2019 às 19:15|17 de Agosto de 2019 às 20:00|Natal, Rio Grande do Norte, Brazil|
Conferência|Ícones: Semiótica, UX e Acessibilidade #CPNatal2|17 de Agosto de 2019 às 19:15|17 de Agosto de 2019 às 20:00|Natal, Rio Grande do Norte, Brazil|
Conferência|CTF como ferramenta de aprendizado em segurança da informação #CPNatal2 #COMUNIDADEDUMONTHACKERSPACE|17 de Agosto de 2019 às 19:15|17 de Agosto de 2019 às 20:00|Natal, Rio Grande do Norte, Brazil|
Conferência|Inovar é ação #CPNatal2|17 de Agosto de 2019 às 19:15|17 de Agosto de 2019 às 20:00|Natal, Rio Grande do Norte, Brazil|
Conferência|Cenário e tendências do mercado Mobile e Apps:como o Google pode ajudá-lo a ter sucesso? #CPNatal2|17 de Agosto de 2019 às 20:30|17 de Agosto de 2019 às 21:30|Natal, Rio Grande do Norte, Brazil|
Conferência|Como impactar usando ppt #CPNatal2 #COMUNIDADELEP|17 de Agosto de 2019 às 22:00|17 de Agosto de 2019 às 22:45|Natal, Rio Grande do Norte, Brazil|
Conferência|Inteligência Artificial em Sala de Aula Invertida #CPNatal2|17 de Agosto de 2019 às 22:00|17 de Agosto de 2019 às 22:45|Natal, Rio Grande do Norte, Brazil|
Conferência|Crowdsourcing - Como solucionar problemas através de redes compartilhadas #CPNatal2|17 de Agosto de 2019 às 22:00|17 de Agosto de 2019 às 22:45|Natal, Rio Grande do Norte, Brazil|
Conferência|Plataforma para veículos inteligentes na perspectiva da Indústria 4.0 #CPNatal2 #COMUNIDADEDUMONTHACKERSPACE|17 de Agosto de 2019 às 22:00|17 de Agosto de 2019 às 22:45|Natal, Rio Grande do Norte, Brazil|
Conferência|Introdução à containers com Docker #CPNatal2 #COMUNIDADEDEVOPSRN|17 de Agosto de 2019 às 22:00|17 de Agosto de 2019 às 22:45|Natal, Rio Grande do Norte, Brazil|
Conferência|Makers e acessibilidade, Quebrando paradigmas por meio da tecnologia #CPNatal2|17 de Agosto de 2019 às 22:00|17 de Agosto de 2019 às 22:45|Natal, Rio Grande do Norte, Brazil|
Conferência|O que elas fazem na Ciência? #CPNatal2 #COMUNIDADEASBOYZINHASARRETADAS|17 de Agosto de 2019 às 22:00|17 de Agosto de 2019 às 23:45|Natal, Rio Grande do Norte, Brazil|
Conferência|Why-fi? Porque ignoramos a segurança em dispositivos sem fio #CPNatal2|17 de Agosto de 2019 às 22:00|17 de Agosto de 2019 às 22:45|Natal, Rio Grande do Norte, Brazil|
Conferência|Chatbot e a revolução da comunicação #CPNatal2|17 de Agosto de 2019 às 23:00|17 de Agosto de 2019 às 23:45|Natal, Rio Grande do Norte, Brazil|
Conferência|Empresas descentralizadas #CPNatal2|17 de Agosto de 2019 às 23:00|17 de Agosto de 2019 às 23:45|Natal, Rio Grande do Norte, Brazil|
Conferência|[EJECT] Planejando e Gerenciando Projetos com Agile #CPNatal2|17 de Agosto de 2019 às 23:00|17 de Agosto de 2019 às 23:45|Natal, Rio Grande do Norte, Brazil|
Conferência|Capture The Flag #CPNatal2 #BANCADADUMONTHACKERSPACE|17 de Agosto de 2019 às 23:00|17 de Agosto de 2019 às 23:45|Natal, Rio Grande do Norte, Brazil|
Conferência|Introdução à Machine Learning #CPNatal2 #OpenCampus|18 de Agosto de 2019 às 10:30|18 de Agosto de 2019 às 11:30|Natal, Rio Grande do Norte, Brazil|
Conferência|Importância de deixar mais fácil o acesso aos dados abertos e aos aplicativos resultante dele #CPNatal2|18 de Agosto de 2019 às 11:00|18 de Agosto de 2019 às 11:45|Natal, Rio Grande do Norte, Brazil|
Conferência|Modernização do Parque de Iluminação #CPNatal2|18 de Agosto de 2019 às 11:00|18 de Agosto de 2019 às 11:45|Natal, Rio Grande do Norte, Brazil|
Conferência|Descubra o seu poder. #CPNatal2 #COMUNIDADEASBOYZINHASARRETADAS|18 de Agosto de 2019 às 11:00|18 de Agosto de 2019 às 12:00|Natal, Rio Grande do Norte, Brazil|
Conferência|OWASP'S DOCKER SUCURITY #CPNatal2 #COMUNIDADEDEEVOPS|18 de Agosto de 2019 às 11:00|18 de Agosto de 2019 às 11:45|Natal, Rio Grande do Norte, Brazil|
Conferência|5 Dicas pra começar bem no desenvolvimento de jogos #CPNatal2|18 de Agosto de 2019 às 11:00|18 de Agosto de 2019 às 11:45|Natal, Rio Grande do Norte, Brazil|
Conferência|Como extrair os melhores resultados de organizações voluntárias #CPNatal2 #COMUNIDADELEP|18 de Agosto de 2019 às 11:00|18 de Agosto de 2019 às 11:45|Natal, Rio Grande do Norte, Brazil|
Conferência|Aplicativos mobile nativos VS híbridos #CPNatal2|18 de Agosto de 2019 às 11:00|18 de Agosto de 2019 às 11:45|Natal, Rio Grande do Norte, Brazil|
Conferência|Programa Norte-rio-grandense de Pensamento Computacional (Pensa RN!) #CPNatal2 #OpenCampus|18 de Agosto de 2019 às 11:45|18 de Agosto de 2019 às 12:45|Natal, Rio Grande do Norte, Brazil|
Conferência|Centro Cultural Trampolim da Vitória Parnamirim RN #CPNatal2|18 de Agosto de 2019 às 12:00|18 de Agosto de 2019 às 13:00|Natal, Rio Grande do Norte, Brazil|
Conferência|Enfrentando desafios e encarando a liderança feminina #CPNatal2 #COMUNIDADEASBOYZINHASARRETADAS|18 de Agosto de 2019 às 12:00|18 de Agosto de 2019 às 13:00|Natal, Rio Grande do Norte, Brazil|
Conferência|Desenvolvimento Seguro de Software: Por onde devo começar? #CPNatal2|18 de Agosto de 2019 às 12:00|18 de Agosto de 2019 às 13:00|Natal, Rio Grande do Norte, Brazil|
Conferência|Medidas de segurança para servidores em nuvem #CPNatal2 #COMUNIDADEDEVOPSRN|18 de Agosto de 2019 às 12:00|18 de Agosto de 2019 às 13:00|Natal, Rio Grande do Norte, Brazil|
Conferência|Uso de Jogos Digitais Como Ferramenta Lúdica No tratamento do câncer infantil no Rio Grande do Norte #CPNatal2|18 de Agosto de 2019 às 12:00|18 de Agosto de 2019 às 13:00|Natal, Rio Grande do Norte, Brazil|
